{
  "schemaVersion": "3.2.0",
  "unit": {
    "executed": true,
    "passed": 491,
    "failed": 0,
    "command": "python -m unittest discover -s tests",
    "evidence": "command:cmd-0068",
    "runId": "ledger-suite"
  },
  "integration": {
    "executed": true,
    "passed": 354,
    "failed": 0,
    "command": "python scripts/iacode/image_tests.py",
    "evidence": "command:cmd-0079",
    "runId": "image-suites"
  },
  "e2e": {
    "executed": true,
    "passed": 48,
    "failed": 0,
    "command": "python -m unittest discover -s infra/tests",
    "evidence": "command:cmd-0080",
    "runId": "infra-suite"
  }
}
