{
  "schemaVersion": "3.2.0",
  "unit": {
    "executed": true,
    "passed": 410,
    "failed": 0,
    "command": "python -m unittest discover -s tests",
    "runId": "cp12-suite",
    "evidence": "command:cmd-0043; one discovery over tests/ covering the unit and integration cases, recorded once because it is one execution. The result object was read directly: 410 discovered, 410 run, 0 failures, 0 errors, 0 skipped."
  },
  "integration": {
    "executed": true,
    "passed": 410,
    "failed": 0,
    "command": "python -m unittest discover -s tests",
    "runId": "cp12-suite",
    "evidence": "command:cmd-0043; the same physical run as the unit categories, deduplicated by runId so one execution is counted once"
  },
  "e2e": {
    "executed": false,
    "passed": 0,
    "failed": 0,
    "command": null,
    "runId": null,
    "evidence": "No runtime exists to exercise end to end during SETUP-00."
  }
}
